Column,layerid,title,description,layertype,creator,format,date,desc_date,place,subject,bbox
11,vector_restricted:KNG_FSH9,"King County, Washington : Water Resource Inventory Area 9 salmon distribution","King County, Washington distribution of 7 salmon species in Water Resource Inventory Area (WRIA) 9 streams, 5 presence classes.",Line,King County (Wash.),Shapefile,2001,2005-2009,Washington,Municipal,"ENVELOPE(-122.396166, -121.305009, 47.598887, 47.130918)"
26,vector_public:AFRICOVER_SM_LNDCOV_GE,Somalia Landcover,"Somalia landcover from The Multipurpose Africover Database for the Environmental Resources produced by the Food and Agriculture Organization of the United Nations (FAO). Scale of the dataset: 1:200,000. The land cover has been produced from visual interpretation of digitally enhanced LANDSAT TM images (Bands 4,3,2) acquired mainly from 1995 - 1998. The land cover classes have been developed using the FAO/UNEP international standard LCCS classification system.",Polygon,Food and Agriculture Organization of the United Nations,Shapefile,2002,2005-2009,Somalia,Land use,"ENVELOPE(40.988628, 51.412724, 11.992188, -1.66719)"
30,vector_restricted:KNG_PLNTWW,"King County, Washington : regional wastewater treatment plants","King County, Washington regional wastewater treatment plants.",Point,King County (Wash.),Shapefile,2003,2005-2009,Washington,Municipal,"ENVELOPE(-122.610896, -121.770357, 48.246059, 47.183208)"
31,vector_public:GLB_HYDBAS,Global GIS : Drainage Basins,"This datalayer is a polygon coverage representing hydrologic drainage basins located worldwide. The data displayed here is derived from the HYDRO 1K Elevation Derivative Database. The drainage basins distributed with the HYDRO1k data set suite are derived using the vector stream networks along with the flow direction data set. Each polygon in the basin data set has been tagged with a Pfafstetter code uniquely identifying each sub-basin. HYDRO1k, developed at the U.S. Geological Survey's (USGS) EROS Data Center, is a geographic database providing comprehensive and consistent global coverage of topographically derived data sets. Developed from the USGS' recently released 30 arc-second digital elevation model (DEM) of the world (GTOPO30), HYDRO1k provides a standard suite of geo-referenced data sets (at a resolution of 1 km) that will be of value for all users who need to organize, evaluate, or process hydrologic information on a continental scale.",Polygon,EROS Data Center,Shapefile,2003,2005-2009,Earth,Hydrology,"ENVELOPE(-179.999347, 179.999, 83.217361, -59.484882)"
34,vector_restricted:ESRI08EURRAILS,Europe Railroads : ESRI Data & Maps 2008,Europe Railroads contains the railroads in Europe.,Line,AND International Publishers N.V.,Shapefile,2006,2005-2009,Europe,Railroads,"ENVELOPE(-9.863300000000001, 65.096, 69.7229, 36.1236)"
35,vector_restricted:ARCCENSUS9,Atlanta Regional Commission 1990 Census Tracts,"This polygon datalayer depicts 1990 census tract level boundaries with associated census attribute data for the Atlanta Regional Commission's (ARC) 10-county region. Data displayed here was derived from the US Census Bureau 1990 TIGER files. ARC documentation states that: 'Please note, a limited number of 'sliver' tracts were merged with other tracts resulting in a total of 417 census tracts for the Atlanta Region. The Census Bureau published data for 424 tracts including tracts 239.98, 316.97, 316.98, 508.98, 807.97, 807.98 and 912.98. These additional seven tracts resulted from the correction of pre-census mapping errors and fall below the Census Bureau's minimum size standards. Consequently, ARC has incorporated these non-standard tracts into adjacent tracts: 239.98 into 234.05; 316.97 into 313.04; 316.98 into 301.98; 508.98 into 504.06; 807.97 into 801.98; 807.98 into 803.00; and 912.98 into 911.03. Also, due to the fact that the Census Bureau reused the 1980 census tract 303.02 erroneously, ARC instead uses the number 303.08 to correctly refer to this tract and to emphasize that it is a new census tract with no geography in common with 1980 census tract 303.02. In terms of attributes for ARC's 417 census tracts, a number of variables have been extracted from the Census Bureau's Summary Tape Files (STF) for this Theme. In addition, selected demographic data has been included by ARC's Research Division through their annual work on employment and population estimates and forecasts. ARC is the source for all the employment data associated with this theme. The source for population, households, and housing unit data is either the Census Bureau or ARC; source by variable is noted in the variable definitions below. It should be clearly noted that the 2000 population and housing unit estimates appearing in this database file are the result of ARC estimates; they are not 2000 Census counts.",Polygon,Atlanta Regional Commission (ARC),Shapefile,1990,2005-2009,Atlanta,boundaries,"ENVELOPE(-84.911057, -83.798904, 34.41259, 33.256512)"
57,vector_restricted:ESRIEURRAILS,ESRI Data & Maps 2000 : Europe Railroads,Europe Railroads represents the railroads of Europe.,Line,"AND Data Solutions, B.V.",Shapefile,1999,2005-2009,Europe,Railroads,"ENVELOPE(-9.868500000000001, 66.4683, 69.725, 36.1245)"
64,vector_restricted:KNG_SWRDIV,"King County, Washington : sewer basin major divisions","King County, Washington Water Pollution Control Division (WPCD) defined boundaries for sewer basin major divisions. Covers also portions of Snohomish and Pierce Counties. Derived from the King County Wastewater Treatment Division's sewer flow basins coverage.",Polygon,King County (Wash.). Wastewater Treatment Division,Shapefile,2001,2005-2009,Washington,Municipal,"ENVELOPE(-122.723622, -121.958748, 48.021536, 47.024274)"
87,vector_restricted:ESRI05USBLKPOP_SD,ESRI Data & Maps 2005 : U.S. Census Block Centroid Populations : South Dakota,U.S. Census Block Centroid Populations : South Dakota represents the population of the U.S. Census block centroids for the state of South Dakota. U.S. Census blocks are the smallest geographic entities within a county for which the Census Bureau tabulates population.,Point,"Environmental Systems Research Institute (Redlands, Calif.)",Shapefile,2000,2005-2009,South Dakota,Census,"ENVELOPE(-104.055193, -96.443954, 45.945125, 42.48333)"
89,vector_restricted:ESRI06USBLKPOP_MS,ESRI Data & Maps 2006 : U.S. Census Block Centroid Populations : Mississippi,U.S. Census Block Centroid Populations : Mississippi represents the populations of the U.S. Census blocks for the state of Mississippi. U.S. Census blocks are the smallest geographic entities within a county for which the Census Bureau tabulates population.,Point,"Tele Atlas North America, Inc.",Shapefile,2004,2005-2009,Mississippi,Census,"ENVELOPE(-91.60431, -88.100657, 34.995947, 30.177896)"
103,vector_restricted:ESRI06USTRANTERM,ESRI Data & Maps 2006 : U.S. Transportation Terminals,"U.S. Transportation Terminals represents locations within United States for transportation terminals such as bus stations, train stations, marine terminals, and other significant transportation nodes.",Point,"Tele Atlas North America, Inc.",Shapefile,2006,2005-2009,United States,Terminals (Transportation),"ENVELOPE(-166.498692, -65.302143, 61.122378, 18.152193)"
104,vector_restricted:BRLTREES,Street Trees (Town of Brookline),"The Street Trees layer is a point coverage inventory of each street tree in the Town of Brookline. Attributes described include species, diameter, condition, management need, growing conditions, predominant root zone cover, presence of utility or power lines, location (on the street or in a park), etc. The Brookline Street Tree Inventory was initially conducted in 1994 as a cooperative project of the University of Massachusetts at Amherst, U.S. Forest Service, Massachusetts Department of Environmental Management, and the Town of Brookline; other supporting organizations include the Harvard University Arnold Arboretum and the Brookline Green Space Alliance. The Town agencies involved in the project include the Conservation Commission, Tree Planting Committee, and the Department of Public Works. This project, thought to be the first comprehensive municipal street tree inventory based on GIS, recruited and trained over 100 citizens to perform the inventory. Teams of volunteers were assigned areas of the town in which to locate each street tree on the Town's Assessor's Maps for digitizing at a later time by UMass/Amherst.",Point,"Brookline GIS, Information Technologies Department",Shapefile,1994,2005-2009,Brookline,Municipal,"ENVELOPE(-71.175901, -71.106432, 42.351642, 42.29479)"
109,vector_public:TG95DEVOTPY,"Census Voting Districts, 1990 - Delaware","This datalayer displays the Voting Districts for the state of Delaware for 1990. A Voting District (VTD) is the generic name for a variety of geographic entities, such as precincts, legislative districts, wards, and election districts, established by state, local, and tribal governments for the purpose of conducting elections. The U.S. Census Bureau first reported data for VTDs following the 1980 census. The 1990 census term voting district replaces the 1980 term election precinct. Because the U.S. Census Bureau requires that VTDs follow boundaries of census blocks, participating states often adjusted the boundaries of the VTDs they submit to conform to pre-established census block boundaries.",Polygon,"U.S. Department of Commerce, Bureau of the Census, Geography Division",Shapefile,1990,2005-2009,Delaware,boundaries,"ENVELOPE(-75.788758, -75.048413, 39.839007, 38.451013)"
114,vector_public:GLB_OTHERP,Global GIS : Miscellaneous hydrography point features,"This datalayer is a point coverage representing worldwide miscellaneous hydrography point features and was published as part of the USGS Global GIS : global coverage database. Features in this layer have a FACC (Feature and Attribute Coding Catalogue) Codes of BA030, defined as, 'Island; A land mass smaller than a continent and surrounded by water,' or BI030, 'Lock; An enclosure with a pair or series of gates used for raising or lowering vessels as they pass from one water level to another,' or BI040, 'Sluice gate; A gate used to regulate the flow of water.' The datalayer was derived from the National Imagery and Mapping Agency's (NIMA, now the Nation Geospatial-Intelligence Agency (NGA)) Vector Map (VMap) Level 0 database (1997). The USGS Global GIS database contains a wealth of USGS and other public domain data, including global coverages of elevation, landcover, seismicity, and resources of minerals and energy at a nominal scale of 1:1 million. The U.S. Geological Survey (USGS) and The American Geological Institute (AGI) announced a cooperative agreement that will focus on making the USGS Global Geographic Information System (GIS) database readily available to educators and the general public in the form of a DVD based world atlas. The Vector Map (VMap) Level 0 database represents the third edition of the Digital Chart of the World. The second edition was a limited release item published 1995 09. The product is dual named to show its lineage to the original DCW, published in 1992, while positioning the revised product within a broader emerging-family of VMap products. VMap Level 0 is a comprehensive 1:1,000,000 scale vector basemap of the world. It consists of cartographic, attribute, and textual data stored on compact disc read only memory (CD-ROM). The primary source for the database is the National Imagery and Mapping Agency's (NIMA) Operational Navigation Chart (ONC) series. This is the largest scale unclassified map series in existence that provides consistent, continuous global coverage of essential basemap features. The database contains more than 1,900 megabytes of vector data and is organized into 10 thematic layers. The data includes major road and rail networks, major hydrologic drainage systems, major utility networks (cross-country pipelines and communication lines), all major airports, elevation contours (1000 foot(ft), with 500ft and 250ft supplemental contours), coastlines, international boundaries and populated places. The database can be accessed directly from the four optical CD-ROMs that store the database or can be transferred to a magnetic media.",Point,United States. National Imagery and Mapping Agency,Shapefile,1997,2005-2009,Earth,Islands,"ENVELOPE(-180, 180, 83.673363, -73.984604)"
115,vector_public:G3860_1864_B3_LC_ST,"Civil War Southern States : State Boundaries, ca. 1864",State boundaries during the US Civil War in the Confederate States. Vector data extracted from digital map provided by the Library of Congress at http://hdl.loc.gov/loc.gmd/g3860.cw0048100. Image georeferencing and feature extraction work done by EastView.,Polygon,Harvard University. Center for Geographic Analysis.,Shapefile,1864,2005-2009,southeastern US,state,"ENVELOPE(-99.24146, -74.211232, 40.829009, 25.093579)"
116,vector_restricted:ESRI07USBLKPOP_KY,Kentucky U.S. Census Block Centroid Populations : ESRI Data & Maps 2007,Kentucky U.S. Census Block Centroid Populations represents the populations of the U.S. Census blocks for the state of Kentucky. U.S. Census blocks are the smallest geographic entities within a county for which the Census Bureau tabulates population.,Point,"Tele Atlas North America, Inc.",Shapefile,2007,2005-2009,Kentucky,Census,"ENVELOPE(-89.55822, -81.99399, 39.140715, 36.498222)"
128,vector_restricted:KNG_WTRBDY,"King County, Washington : open water (polygons)","King County, Washington lakes, rivers, and streams polygons. Covers also the Puget Sound and portions of Snohomish and Pierce Counties.",Polygon,King County (Wash.),Shapefile,2003,2005-2009,Washington,Municipal,"ENVELOPE(-122.746102, -121.070761, 48.247866, 46.777877)"
136,vector_public:TG95DELKALN,"Census Class A Roads, 1995 - Delaware","This datalayer displays the Type A class roads thoughout the state of Delaware. Feature Class A roads include: Primary roads with limited access (interstate highways, toll highways); Primary roads without limited access (US highways, some state highways and county highways that connect cities and larger towns); regional and state highways state highways, Secondary and connecting roads (includes mostly state highways, but may include some county highways that connect smaller towns, subdivisions, and neighborhoods); Local, neighborhood, and rural roads, city streets, and vehicular trails. According to the TIGER95 Data Dictionary, the definition of a divided highway has been the source of considerable discussion. Earlier specifications have defined a divided road as having, '..opposing traffic lanes that are physically separated by a median strip no less than 70 feet wide in former GBF/DIME areas or no less than 200 feet wide in non-GBF/DIME areas.' This definition caused confusion in the proper coding of interstates having narrow medians. To clarify the situation, the Census Bureau now uses the term divided to refer to a road with opposing traffic lanes separated by any size median, and separated to refer to lanes that are represented in the Census TIGER data base as two distinct complete chains. Earlier operations may have depicted widely separated lanes as a single line in the data base or created separate lines when the median was small, depending on the available source used during the update. Road types possibly represented here are defined as follows: -Primary Highway With Limited Access (A1): Interstate highways and some toll highways are in this category and are distinguished by the presence of interchanges. These highways are accessed by way of ramps and have multiple lanes of traffic. The opposing traffic lanes are divided by a median strip. The TIGER/Line files may depict these opposing traffic lanes as two distinct lines in which case, the road is called separated. -Primary Road Without Limited Access (A2): This category includes nationally and regionally important highways that do not have limited access as required by category A1. It consists mainly of US highways, but may include some state highways and county highways that connect cities and larger towns. A road in this category must be hard-surface (concrete or asphalt). It has intersections with other roads, may be divided or undivided, and have multilane or single-lane characteristics. -Secondary and Connecting Road (A3): This category includes mostly state highways, but may include some county highways that connect smaller towns, subdivisions, and neighborhoods. The roads in this category are smaller than roads in Category A2, must be hard-surface (concrete or asphalt), and are usually undivided with single-lane characteristics. These roads usually have a local name along with a route number and intersect with many other roads and driveways. -Local, Neighborhood, and Rural Road (A4): A road in this category is used for local traffic and usually has a single lane of traffic in each direction. In an urban area, this is a neighborhood road and street that is not a thoroughfare belonging in categories A2 or A3. In a rural area, this is a short-distance road connecting the smallest towns; the road may or may not have a state or county route number. Scenic park roads, unimproved or unpaved roads,and industrial roads are included in this category. Most roads in the Nation are classified as A4 roads. -Vehicular Trail (A5): A road in this category is usable only by four-wheel drive vehicles, is usually a one-lane dirt trail, and is found almost exclusively in very rural areas. Sometimes the road is called a fire road or logging road and may include an abandoned railroad grade where the tracks have been removed. Minor, unpaved roads usable by ordinary cars and trucks belong in category -Road with Special Characteristics (A6): This category includes roads, portions of a road, intersections of a road, or the ends of a road that are parts of the vehicular highway system and that have separately identifiable characteristics. -Road as Other Thoroughfare (A7): A road in this category is not part of the vehicular highway system. It is used by bicyclists or pedestrians, and is typically inaccessible to mainstream motor traffic except for private-owner and service vehicles. This category includes foot and hiking trails located on park and forest land, as well as stairs or walkways that follow a road right-of-way and have names similar to road names.",Line,"U.S. Department of Commerce, Bureau of the Census, Geography Division",Shapefile,1995,2005-2009,Delaware,transportation,"ENVELOPE(-75.788658, -75.049926, 39.839007, 38.451013)"
159,vector_restricted:ESRI06USTRACTS,ESRI Data & Maps 2006 : U.S. Census Tracts,U.S. Census Tracts represents the U.S. Census tracts of the United States in the 50 states and the District of Columbia.,Polygon,"Tele Atlas North America, Inc.",Shapefile,2006,2005-2009,United States,Census districts,"ENVELOPE(-178.227822, -65.244128, 71.390482, 17.881242)"
174,vector_public:GLB_RVRBAS,Global GIS : international river basins of the world,"This datalayer is a polygon coverage representing the Transboundary Freshwater Dispute Database dataset: international river basins of the world. This version of the datalayer was published as part of the USGS Global GIS : global coverage database (2003). Does not cover Antarctica. The USGS Global GIS database contains a wealth of USGS and other public domain data, including global coverages of elevation, landcover, seismicity, and resources of minerals and energy at a nominal scale of 1:1 million. The U.S. Geological Survey (USGS) and The American Geological Institute (AGI) announced a cooperative agreement that will focus on making the USGS Global Geographic Information System (GIS) database readily available to educators and the general public in the form of a DVD based world atlas.",Polygon,"Wolf, Aaron T.",Shapefile,2003,2005-2009,Earth,Watersheds,"ENVELOPE(-164.698547, 145.207169, 71.440003, -54.748638)"
177,vector_restricted:ESRI04USCITIES_DTL,ESRI Data & Maps 2004 : U.S. National Atlas Cities,"U.S. National Atlas Cities represents cities and towns in the United States, Puerto Rico, and U.S. Virgin Islands.",Point,Geological Survey (U.S.),Shapefile,null,2005-2009,United States,Cities and towns,"ENVELOPE(-174.198764, 178.8746, 71.290064, 17.711709)"
178,vector_restricted:ESRI04USPUBLDSUR,ESRI Data & Maps 2004 : U.S. National Atlas Public Land Survey,"U.S. National Atlas Public Land Survey represents the Public Land Surveys (for example, donation lands, land grants, private and public lands) of the United States.",Polygon,Geological Survey (U.S.),Shapefile,1972,2005-2009,United States,Public lands,"ENVELOPE(-179.133391, 179.788209, 71.398182, 17.674691)"
198,vector_public:AFRICOVER_SM_ADM,Somalia Administrative Boundaries,"Somalia administrative boundaries from The Multipurpose Africover Database for the Environmental Resources produced by the Food and Agriculture Organization of the United Nations (FAO). Scale of the dataset: 1:100,000. The national and administrative boundaries have been taken from DCW.",Polygon,Food and Agriculture Organization of the United Nations,Shapefile,2002,2005-2009,Somalia,Boundaries,"ENVELOPE(40.988628, 51.412724, 11.992188, -1.653385)"
199,vector_restricted:ESRI04MIBLKPOP,ESRI Data & Maps 2004 : U.S. Census Block Centroid Populations : Michigan,U.S. Census Block Centroid Populations : Michigan represents the population of the U.S. Census block centroids for the state of Michigan. U.S. Census blocks are the smallest geographic entities within a county for which the Census Bureau tabulates population.,Point,"Environmental Systems Research Institute (Redlands, Calif.)",Shapefile,2003,2005-2009,Michigan,Census,"ENVELOPE(-90.414191, -82.319709, 48.262255, 41.699145)"
200,vector_public:G3860_1864_B3_LC_RR,"Civil War Southern States : Railroads, ca. 1864",Railroad routes during the US Civil War in the Confederate States. Vector data extracted from digital map provided by the Library of Congress at http://hdl.loc.gov/loc.gmd/g3860.cw0048100. Image georeferencing and feature extraction work done by EastView.,Line,Harvard University. Center for Geographic Analysis.,Shapefile,1864,2005-2009,southeastern US,railroad,"ENVELOPE(-98.228572, -74.429404, 40.845152, 29.091333)"
204,vector_restricted:INDIAHIST_DISTRICT61,"India : District Boundaries, 1961","This datalayer shows district boundaries of India for 1961. Includes district socio-demographic Census attribute data such as total population, population by sex, rural/urban populations, household and employment statistics. This layer is part of the India HistoricMap dataset showing decadal change in district boundaries of India since 1951. Socio-demographic data is included for the Census years i.e. 1951, 1961, 1971, 1981, 1991 and 2001. This data layer is sourced from secondary government sources, chiefly Survey of India, Census of India, Election Commission, etc. Scale 1:1,000,000.",Polygon,ML InfoMap (Firm),Shapefile,1961,2005-2009,India,Administrative and political divisions,"ENVELOPE(68.196831, 97.409096, 37.121712, 6.767454)"
205,vector_restricted:CH_CENSUS1990_PARTB,China historical 1990 county population census data - Part B,"This polygon datalayer includes China county boundaries with 1990 population census data. It is one (Part B) of two layers containing the entire 1990 population census data. The 1990 administrative maps were primarily based on the 'The Administrative Maps of the People's Republic of China,' published by China Map Press, and some other yearly administrative maps. This datalayer is part of the Historical county population census data with maps: 1953, 1964, 1982, 1990, 2000 data set produced by the All China Marketing Research Co. and distributed by the University of Michigan, China Data Center (2005). The historical county population Census data include population Census data for China at county level for 1953, 1964, 1980, 1990, and 2000, which are integrated with associated county GIS maps.",Polygon,Beijing Hua tong ren shi chang xin xi you xian ze ren gong si,Shapefile,1990,2005-2009,China,Census,"ENVELOPE(73.44696, 135.085831, 53.557926, 6.318641)"
210,vector_restricted:ESRI07USBLKPOP_TX,Texas U.S. Census Block Centroid Populations : ESRI Data & Maps 2007,Texas U.S. Census Block Centroid Populations represents the populations of the U.S. Census blocks for the state of Texas. U.S. Census blocks are the smallest geographic entities within a county for which the Census Bureau tabulates population.,Point,"Tele Atlas North America, Inc.",Shapefile,2007,2005-2009,Texas,Census,"ENVELOPE(-106.642175, -93.527592, 36.49961, 25.841348)"
226,vector_restricted:ESRI07USBLKPOP_VA,Virginia U.S. Census Block Centroid Populations : ESRI Data & Maps 2007,Virginia U.S. Census Block Centroid Populations represents the populations of the U.S. Census blocks for the state of Virginia. U.S. Census blocks are the smallest geographic entities within a county for which the Census Bureau tabulates population.,Point,"Tele Atlas North America, Inc.",Shapefile,2007,2005-2009,Virginia,Census,"ENVELOPE(-83.669011, -75.259284, 39.464099, 36.541004)"
238,vector_restricted:ESRI06USBLKGRP,ESRI Data & Maps 2006 : U.S. Census Block Groups,U.S. Census Block Groups represents the U.S. Census block groups of the United States.,Polygon,"Tele Atlas North America, Inc.",Shapefile,2006,2005-2009,United States,Census,"ENVELOPE(-178.227822, -65.244128, 71.390482, 17.881242)"
