Column,layerid,title,description,layertype,creator,format,date,desc_date,place,subject,bbox
2489,vector_restricted:KNG_ZONE,"King County, Washington : countywide zoning","Zoning boundaries for unincorporated King County, Washington.",Polygon,King County (Wash.),Shapefile,2003,2005-2009,Washington,Municipal,"ENVELOPE(-122.54255, -121.061526, 47.787673, 47.073882)"
2494,vector_restricted:ESRI07USBLKPOP_CO,Colorado U.S. Census Block Centroid Populations : ESRI Data & Maps 2007,Colorado U.S. Census Block Centroid Populations represents the populations of the U.S. Census blocks for the state of Colorado. U.S. Census blocks are the smallest geographic entities within a county for which the Census Bureau tabulates population.,Point,"Tele Atlas North America, Inc.",Shapefile,2007,2005-2009,Colorado,Census,"ENVELOPE(-109.059961, -102.043883, 41.002789, 36.994028)"
2499,vector_restricted:MGISZONECP2,MassGIS 2003 Massachusetts Surface Water Supply Protection Areas (Zone C) (Polygons) (March 2003),"This datalayer consists of polygons representing Massachusetts Surface Water Supply Protection Zones (Zone C). (See also the Surface Water Supply Protection Zones (Zone C) (Region Polygons) and the Surface Water Supply Protection Zones (Zone C) (Arcs) datalayers.) Three datalayers (ZONE A, ZONE B, ZONE C) delineate those areas included in 310 CMR 22.00, the Massachusetts Drinking Water Regulations, as Surface Water Supply Protection Zones: ZONE A: represents a) the land area between the surface water source and the upper boundary of the bank; b) the land area within a 400 foot lateral distance from the upper boundary of the bank of a Class A surface water source, as defined in 314 CMR 4.05(3)(a); and c) the land area within a 200 foot lateral distance from the upper boundary of the bank of a tributary or associated surface water body. ZONE B: represents the land area within one-half mile of the upper boundary of the bank of a Class A surface water source, as defined in 314 CMR 4.05(3)(a), or edge of watershed, whichever is less. Zone B always includes the land area within a 400 ft lateral distance from the upper boundary of the bank of the Class A surface water source. ZONE C: represents the land area not designated as Zone A or B within the watershed of a Class A surface water source, as defined in 314 CMR 4.05(3)(a). All known surface water supplies have zones delineated, but some may be covered by other legislation. Areas with a status value of M are included for reference but are not covered by 310 CMR 22.00. Each area is delineated in a separate datalayer, Zone A, Zone B, and Zone C.",Polygon,MassGIS (Office : Mass.),Shapefile,2003,2005-2009,Massachusetts,Water-supply,"ENVELOPE(-73.513221, -70.585851, 42.867638, 41.556506)"
2501,vector_public:AFRICOVER_UG_ADM,Uganda Administrative Boundaries,"Uganda administrative boundaries from The Multipurpose Africover Database for the Environmental Resources produced by the Food and Agriculture Organization of the United Nations (FAO). Scale of the dataset: 1:100,000. The national and administrative boundaries have been provided by the National Focal Point Institution (NFPI).",Polygon,Food and Agriculture Organization of the United Nations,Shapefile,2003,2005-2009,Uganda,Boundaries,"ENVELOPE(29.57317, 35.026379, 4.216817, -1.481385)"
2514,vector_restricted:ESRI07USTRANTERM,U.S. Transportation Terminals : ESRI Data & Maps 2007,"U.S. Transportation Terminals represents locations within United States for transportation terminals such as bus stations, train stations, marine terminals, and other significant transportation nodes.",Point,"Tele Atlas North America, Inc.",Shapefile,2007,2005-2009,United States,Terminals (Transportation),"ENVELOPE(-166.498692, -65.62971, 61.174671, 18.33358)"
2517,vector_restricted:ESRI04AZBLKPOP,ESRI Data & Maps 2004 : U.S. Census Block Centroid Populations : Arizona,U.S. Census Block Centroid Populations : Arizona represents the population of the U.S. Census block centroids for the state of Arizona. U.S. Census blocks are the smallest geographic entities within a county for which the Census Bureau tabulates population.,Point,"Environmental Systems Research Institute (Redlands, Calif.)",Shapefile,2003,2005-2009,Arizona,Census,"ENVELOPE(-114.811664, -109.045736, 37.001564, 31.332936)"
2523,vector_restricted:ESRI04TNBLKPOP,ESRI Data & Maps 2004 : U.S. Census Block Centroid Populations : Tennessee,U.S. Census Block Centroid Populations : Tennessee represents the population of the U.S. Census block centroids for the state of Tennessee. U.S. Census blocks are the smallest geographic entities within a county for which the Census Bureau tabulates population.,Point,"Environmental Systems Research Institute (Redlands, Calif.)",Shapefile,2003,2005-2009,Tennessee,Census,"ENVELOPE(-90.306909, -81.657936, 36.677727, 34.983)"
2532,vector_public:MGISSENATEP1,MassGIS 2000 Massachusetts Senate Legislative Districts (1993),The Massachusetts State Senate Legislative Districts (1993) datalayer reflects the State Senate district boundaries as defined by Chapter 274 of the Acts of 1993. The name of the statewide datalayer is SENATE93. Names of elected officials are up-to-date through March 1997.,Polygon,MassGIS (Office : Mass.),Shapefile,1997,2005-2009,Massachusetts,Election districts,"ENVELOPE(-73.50814, -69.927802, 42.88679, 41.237962)"
2535,vector_restricted:ESRI04LAKES,ESRI Data & Maps 2004 : World Lakes,World Lakes represents the major lakes and inland seas within the world.,Polygon,"Environmental Systems Research Institute (Redlands, Calif.)",Shapefile,1992,2005-2009,Earth,Lakes,"ENVELOPE(-125.123318, 109.965, 67.046936, -16.606264)"
2536,vector_restricted:ARCGAFAC,Atlanta Regional Commission Community Facilities,"This point datalayer depicts community facilities throughout the state of Georgia ARC documentation states that facilities shown here include: city halls, courthouses, sheriffs' offices, marshals' offices, police stations, fire stations, city jails, county jails, county correctional facilities, state prisons, federal penitentiaries, public and private universities, public and private 4-year colleges, public and private 2-year colleges, public vocational technical schools, public high schools, private schools, airports, hospitals, libraries, water systems, and wastewater treatment plants.",Point,Atlanta Regional Commission (ARC),Shapefile,1999,2005-2009,Atlanta,structure,"ENVELOPE(-85.552612, -80.842346, 35.02607, 30.395168)"
2537,vector_public:GLB_US_ORE,"Global GIS : Mineral Resource Data System (MRDS) data in ArcView Shape File Format, for Spacial Data Delivery Project, 1999","This datalayer is a point coverage representing metallic and non-metallic mineral resources worldwide. This data was derived from the Mineral Resource Data System (MRDS) data in ArcView Shape File Format, for Spatial Data Delivery Project, 1999 (Edition: Version 1.1) and was published as part of the USGS Global GIS : global coverage database (2003). MRDS contains variable-length records of metallic and nonmetallic mineral resources of the world. A record contains descriptive information about mineral deposits and mineral commodities. The types of information in the data base include deposit name, location, commodity, deposit description, geologic characteristics, production, reserves, potential resources, and references. The Mineral Resource Data System master database is not accessible via the WWW. The large number of multi-valued fields make it difficult to import all the fields into a data format that can be utilized by the ArcView Internet Map Server Software. This dataset contains all MRDS locations, but only 44 of the possible 226 fields. A data structure was created in Access 97. Data was imported into the file structure and then processed into Arc View, where it was transformed into shape files that are used by the IMS software to serve the MRDS data and permit access via the www. The USGS Global GIS database contains a wealth of USGS and other public domain data, including global coverages of elevation, landcover, seismicity, and resources of minerals and energy at a nominal scale of 1:1 million. The U.S. Geological Survey (USGS) and The American Geological Institute (AGI) announced a cooperative agreement that will focus on making the USGS Global Geographic Information System (GIS) database readily available to educators and the general public in the form of a DVD based world atlas.",Point,American Geological Institute,Shapefile,1972,2005-2009,Earth,Geology,"ENVELOPE(-176.729722, 179.549167, 78.380556, -73)"
2551,vector_restricted:ESRI04WIBLKPOP,ESRI Data & Maps 2004 : U.S. Census Block Centroid Populations : Wisconsin,U.S. Census Block Centroid Populations : Wisconsin represents the population of the U.S. Census block centroids for the state of Wisconsin. U.S. Census blocks are the smallest geographic entities within a county for which the Census Bureau tabulates population.,Point,"Environmental Systems Research Institute (Redlands, Calif.)",Shapefile,2003,2005-2009,Wisconsin,Census,"ENVELOPE(-92.888064, -86.764436, 47.070509, 42.492218)"
2556,vector_restricted:KNG_MTPEAK,"King County, Washington : mountain peaks","King County, Washington mountain peaks with elevations.",Point,King County (Wash.),Shapefile,2003,2005-2009,Washington,Municipal,"ENVELOPE(-122.044058, -121.099017, 47.780776, 47.106729)"
2557,vector_restricted:ESRI06EURPLACES,ESRI Data & Maps 2006 : Europe Places,Europe Places contains the populated places in Europe.,Point,AND International Publishers N.V.,Shapefile,2005,2005-2009,Europe,Cities and towns,"ENVELOPE(-27.2132, 64.0749, 71.1666, 27.7652)"
2563,vector_restricted:ESRI04MXCITIES,ESRI Data & Maps 2004 : Mexico Cities,Mexico Cities represents the locations of cities in Mexico.,Point,"Sistemas de Informacion Geografica, S.A.",Shapefile,2002,2005-2009,Mexico,Cities and towns,"ENVELOPE(-117.056845, -86.855473, 32.715764, 14.592527)"
2590,vector_restricted:INDIAPOLL_UTTARPRAD,"Uttar Pradesh, India : State Assembly Constituency Boundaries and Election Data, 1991-2007","This datalayer shows state Legislative Assembly constituency boundaries and data relating to the past five Assembly elections (1991, 1993, 1996, 2002, 2007) for the State of Uttar Pradesh, India. Includes attribute data on election parties, candidates, voters, and results. This layer is part of the PollMap of India dataset published by ML InfoMap which includes parliamentary constituency boundaries for India, Assembly constituency boundaries for all states, and data relating to the past four national elections for each State of India. This data layer is sourced from secondary government sources, chiefly Survey of India, Census of India, Election Commission, etc. Scale 1:1,000,000.",Polygon,ML InfoMap (Firm),Shapefile,1991,2005-2009,India,Administrative and political divisions,"ENVELOPE(77.094902, 84.634766, 30.419489, 23.851858)"
2601,vector_restricted:ESRI06USBLKPOP_DC,ESRI Data & Maps 2006 : U.S. Census Block Centroid Populations : District of Columbia,U.S. Census Block Centroid Populations : District of Columbia represents the populations of the U.S. Census blocks for the District of Columbia. U.S. Census blocks are the smallest geographic entities within a county for which the Census Bureau tabulates population.,Point,"Tele Atlas North America, Inc.",Shapefile,2004,2005-2009,District of Columbia,Census,"ENVELOPE(-77.117481, -76.910339, 38.993497, 38.792645)"
2611,vector_public:TG95ARWATPY,"Census Water Bodies, 1995 - Arkansas","This datalayer displays water bodies throughout the state of Arkansas. This category includes lakes, ponds, bays, rivers, reservoirs and other water features. Predominant features represented in this layer have Census Feature Class Codes (CFCCs) of: H01 (Shoreline of perennial water feature); H11 (Perennial stream or river); H12 (Intermittent stream, river, or wash); H21 (Perennial canal, ditch, or aqueduct); H31 (Perennial lake or pond); H41 (Perennial reservoir); H51 (Bay, estuary, gulf, or sound). The Feature Name attribute further identifies water bodies as rivers, creeks, branches, forks, etc.",Polygon,"U.S. Department of Commerce, Bureau of the Census, Geography Division",Shapefile,1995,2005-2009,Arkansas,inlandWaters,"ENVELOPE(-94.561472, -89.644838, 36.499163, 33.004139)"
2612,vector_public:TG95DECTYPY,"Census Counties, 1995 - Delaware","This datalayer displays the counties for the state of Delaware, based on a ground condition of January 1, 1990. The primary legal divisions of most states are termed ''counties.'' Each county and statistically equivalent entity is assigned a three-digit Federal Information Processing Standards code that is unique within the state. These codes are assigned in alphabetical order of county or county equivalent within each state.",Polygon,"U.S. Department of Commerce, Bureau of the Census, Geography Division",Shapefile,1990,2005-2009,Delaware,boundaries,"ENVELOPE(-75.788758, -75.048413, 39.839007, 38.451013)"
2614,vector_restricted:ESRI05USDTL_RIVERS_AZ,ESRI Data & Maps 2005 : U.S. Rivers and Streams : Arizona,U.S. Rivers and Streams : Arizona represents detailed rivers and streams for the state of Arizona.,Line,Geological Survey (U.S.),Shapefile,2004,2005-2009,Arizona,Rivers,"ENVELOPE(-114.816587, -109.045236, 37.003983, 31.332313)"
2628,vector_restricted:ESRI04USPRL_DTL,ESRI Data & Maps 2004 : U.S. GDT Park Landmarks,"U.S. GDT Park Landmarks represents parks and forests within United States at National, State, and local levels.",Polygon,"Geographic Data Technology, Inc.",Shapefile,2002,2005-2009,United States,Parks,"ENVELOPE(-167.540445, -65.707418, 68.649982, 18.008555)"
2667,vector_restricted:KNG_SWRBAS,"King County, Washington : sewer flow basins","King County, Washington Water Pollution Control Division (WPCD) defined boundaries for sewer basins including planning basins. Covers also portions of Snohomish and Pierce Counties.",Polygon,King County (Wash.). Wastewater Treatment Division,Shapefile,2001,2005-2009,Washington,Municipal,"ENVELOPE(-122.723622, -121.958748, 48.021536, 47.024274)"
2668,vector_restricted:ESRI07USBLKPOP_IA,Iowa U.S. Census Block Centroid Populations : ESRI Data & Maps 2007,Iowa U.S. Census Block Centroid Populations represents the populations of the U.S. Census blocks for the state of Iowa. U.S. Census blocks are the smallest geographic entities within a county for which the Census Bureau tabulates population.,Point,"Tele Atlas North America, Inc.",Shapefile,2007,2005-2009,Iowa,Census,"ENVELOPE(-96.622905, -90.14834, 43.500777, 40.381071)"
2684,vector_restricted:ESRI05USGLOCALE,ESRI Data & Maps 2005 : U.S. Geographic Names Information System Locales,U.S. Geographic Names Information System Locales represents an automated inventory of the proper names and locations of physical and cultural geographic features located throughout the United States and its Territories.,Point,Geological Survey (U.S.),Shapefile,1981,2005-2009,United States,Recreation areas,"ENVELOPE(-176.813324, 179.288947, 71.385147, -14.32917)"
2687,vector_restricted:ARCOLYMPC,Atlanta Regional Commission Olympic Venues,"This polygon datalayer depicts Olympic venues used during the 1996 Olympic games, along with associated attribute data for the Atlanta Regional Commission's (ARC) 10-county region. ARC documentation states that: This Theme was created to show the location of venues in the Atlanta Region in preparation for the 1996 Olympics. The geographic extent of this Theme extends beyond the Atlanta Region to the north and east, including Lake Lanier in Hall County.",Polygon,Atlanta Regional Commission (ARC),Shapefile,1996,2005-2009,Atlanta,structure,"ENVELOPE(-84.571281, -83.768204, 34.373932, 33.519993)"
2705,vector_restricted:ESRI06USBLKPOP_OK,ESRI Data & Maps 2006 : U.S. Census Block Centroid Populations : Oklahoma,U.S. Census Block Centroid Populations : Oklahoma represents the populations of the U.S. Census blocks for the state of Oklahoma. U.S. Census blocks are the smallest geographic entities within a county for which the Census Bureau tabulates population.,Point,"Tele Atlas North America, Inc.",Shapefile,2004,2005-2009,Oklahoma,Census,"ENVELOPE(-103.002462, -94.432794, 37.002038, 33.620116)"
2720,vector_public:MGISGEONAMX2,MassGIS 2003 Massachusetts Geographic Place Names : Civic Features (March 2003),"This point datalayer represents place names for civic features in the state of Massachusetts (March 2003), which may be used for map labels. The Massachusetts Department of Environmental Protection (DEP) GIS Group and MassGIS maintain the data. Geographic Place Names for the state are grouped into 3 separate datalayers: Hydrographic Features - lakes, ponds, streams, rivers, bays, harbors, channels Civic Features - city and town names, sections, villages Hypsographic Features - hills, mountains, points, beaches, islands",Point,MassGIS (Office : Mass.),Shapefile,2003,2005-2009,Massachusetts,"Names, Geographical","ENVELOPE(-73.946745, -69.917659, 42.867313, 34.244387)"
2726,vector_public:AFRICOVER_EG_SPAT_AGG,Egypt Spatially Aggregated Multipurpose Landcover Database,"Egypt spatially aggregated multipurpose landcover database from The Multipurpose Africover Database for the Environmental Resources produced by the Food and Agriculture Organization of the United Nations (FAO). Scale of the dataset: 1:200,000. This dataset is a spatially reaggregated version of the original national Africover landcover multipurpose database. The land cover has been produced from visual interpretation of digitally enhanced LANDSAT TM images (Bands 4,3,2) acquired mainly in the year 1997. The land cover classes have been developed using the FAO/UNEP international standard LCCS classification system.",Polygon,Food and Agriculture Organization of the United Nations,Shapefile,2002,2005-2009,Egypt,Land use,"ENVELOPE(24.697903, 36.898693, 31.667225, 21.814236)"
2732,vector_restricted:ESRI04COBLKPOP,ESRI Data & Maps 2004 : U.S. Census Block Centroid Populations : Colorado,U.S. Census Block Centroid Populations : Colorado represents the population of the U.S. Census block centroids for the state of Colorado. U.S. Census blocks are the smallest geographic entities within a county for which the Census Bureau tabulates population.,Point,"Environmental Systems Research Institute (Redlands, Calif.)",Shapefile,2003,2005-2009,Colorado,Census,"ENVELOPE(-109.059873, -102.043882, 41.002818, 36.993609)"
2733,vector_restricted:KNG_CTYL,"King County, Washington : municipal boundaries (arcs)","This arc datalayer contains boundaries for King County, Washington incorporated places.",Line,King County (Wash.),Shapefile,2003,2005-2009,Washington,Municipal,"ENVELOPE(-122.465607, -121.344753, 47.787486, 47.174239)"
2742,vector_public:AFRICOVER_UG_POLBND,Uganda National Boundaries,"Uganda national boundaries from The Multipurpose Africover Database for the Environmental Resources produced by the Food and Agriculture Organization of the United Nations (FAO). Scale of the dataset: 1:100,000. The national and administrative boundaries have been provided by the National Focal Point Institution (NFPI).",Polygon,Food and Agriculture Organization of the United Nations,Shapefile,2003,2005-2009,Uganda,Boundaries,"ENVELOPE(29.573359, 35.026379, 4.216817, -1.481385)"
2744,vector_restricted:ESRI05USPUBLDSUR,ESRI Data & Maps 2005 : U.S. National Atlas Public Land Survey,"U.S. National Atlas Public Land Survey represents the Public Land Surveys (for example, donation lands, land grants, private and public lands) of the United States.",Polygon,Geological Survey (U.S.),Shapefile,null,2005-2009,United States,Public lands,"ENVELOPE(-179.133392, 179.78821, 71.398185, 17.674692)"
2781,vector_public:AFRICOVER_BU_GRASS_AGG,Burundi Thematic Grassland Aggregation Landcover,"Burundi thematic grassland aggregation landcover from The Multipurpose Africover Database for the Environmental Resources produced by the Food and Agriculture Organization of the United Nations (FAO). Scale of the dataset: 1:100,000. This dataset is a reaggregated version of the original national Africover landcover multipurpose database. It contains all natural vegetation with a herbaceous component. The land cover has been produced from visual interpretation of digitally enhanced LANDSAT TM images (Bands 4,3,2) acquired mainly in the year 1999. The land cover classes have been developed using the FAO/UNEP international standard LCCS classification system.",Polygon,Food and Agriculture Organization of the United Nations,Shapefile,2002,2005-2009,Burundi,Land use,"ENVELOPE(28.98251, 30.903442, -2.219196, -4.559046)"
2787,vector_restricted:ESRI07USCBSA,U.S. Core Based Statistical Areas : ESRI Data & Maps 2007,"U.S. Core Based Statistical Areas represents geographic entities, defined by the United States Office of Management and Budget for use by Federal statistical agencies, based on the concept of a core area with a large population nucleus, plus adjacent communities having a high degree of economic and social integration with that core. A Core-Based Statistical Area consists of a county containing an Incorporated Place or Census Designated Place with a population of at least 10,000 along with any adjacent counties that have at least 25 percent of employed residents of the county who work in the CBSA's core or central county. CBSAs are categorized as being either Metropolitan or Micropolitan. Each Metropolitan Statistical Area must have at least one urbanized area of 50,000 or more inhabitants. Each Micropolitan Statistical Area must have at least one urban cluster of at least 10,000 but less than 50,000 population.",Polygon,"Environmental Systems Research Institute (Redlands, Calif.)",Shapefile,2007,2005-2009,United States,Metropolitan areas,"ENVELOPE(-160.554894, -67.93907, 65.454476, 18.910787)"
2789,vector_restricted:ESRIEURDEMOG,ESRI Data & Maps 2000 : Europe Province/State Demographics,"Europe Province/State Demographics represents 628 areas of Europe, which in most cases, are provinces, multiple provinces or countries.",Polygon,GfK Marktforschung,Shapefile,1981,2005-2009,Europe,Demography,"ENVELOPE(-31.2672, 66.0633, 71.1839, 27.6359)"
2796,vector_restricted:ARCMAJROAD,Atlanta Regional Commission Major Road Features,"This polyline datalayer depicts major road routes and associated attribute data for the Atlanta Regional Commission's (ARC) 10-county region. ARC documentation states that: The features included in this Theme were identified by ARC's Transportation Planning Division (TPD) as major roads. Although this Theme may not include roads considered major for all purposes, it is a useful network of regionally significant routes in the Atlanta Region. This Theme is a subset of ARCmap, ARC's street centerline database. Please note that ARCmap has recently been combined with the Georgia Department of Transportation (GDOT) DLGF street base and the 2000 Census TIGER street centerline file to create the State's new Addressed DLGF database.",Line,Atlanta Regional Commission (ARC),Shapefile,1995,2005-2009,Atlanta,transportation,"ENVELOPE(-84.911339, -83.865402, 34.380795, 33.257355)"
2797,vector_restricted:KNG_WELLALL,"King County, Washington : water supply wells","This dataset shows the locations of all wells listed in the King County Groundwater database. These are mainly private wells of individual homeowners, but some Public Water Supply group A or group B wells are also included. See also the related datasets: water supply wells, group A, and water supply wells, group B datalayers.",Point,King County (Wash.),Shapefile,2001,2005-2009,Washington,Municipal,"ENVELOPE(-122.544787, -121.403241, 47.904151, 47.139973)"
2819,vector_restricted:ESRI04CANWATER,ESRI Data & Maps 2004 : Canada Water Bodies,"Canada Water Bodies represents the major fresh water bodies within Canada including lakes/lac, large rivers/fleuve, reservoirs, and bays/baie. The boundaries are based on Statistics Canada data.",Polygon,DMTI Spatial Inc.,Shapefile,2002,2005-2009,Canada,Bodies of water,"ENVELOPE(-141.0013, -52.670264, 78.946164, 41.386664)"
2825,vector_restricted:ESRI05USBLKPOP_MI,ESRI Data & Maps 2005 : U.S. Census Block Centroid Populations : Michigan,U.S. Census Block Centroid Populations : Michigan represents the population of the U.S. Census block centroids for the state of Michigan. U.S. Census blocks are the smallest geographic entities within a county for which the Census Bureau tabulates population.,Point,"Environmental Systems Research Institute (Redlands, Calif.)",Shapefile,2000,2005-2009,Michigan,Census,"ENVELOPE(-90.414188, -82.415906, 48.262255, 41.699147)"
2829,vector_restricted:ESRI05USZIP_POLY,ESRI Data & Maps 2005 : U.S. ZIP Code Areas,"U.S. ZIP Code Areas represents five-digit ZIP Code areas used by the U.S. Postal Service to deliver mail more effectively. The first digit of a five-digit ZIP Code divides the country into 10 large groups of states numbered from 0 in the Northeast to 9 in the far West. Within these areas, each state is divided into an average of 10 smaller geographical areas, identified by the second and third digits. These digits, in conjunction with the first digit, represent a sectional center facility or a mail processing facility area. The fourth and fifth digits identify a post office, station, branch or local delivery area.",Polygon,"Tele Atlas North America, Inc.",Shapefile,2004,2005-2009,United States,Zip codes,"ENVELOPE(-178.226727, -65.244129, 71.357307, 17.881242)"
