Column,layerid,title,description,layertype,creator,format,date,desc_date,place,subject,bbox
8208,vector_restricted:ESRI07USURBAN_DTL,U.S. National Atlas Urbanized Areas : ESRI Data & Maps 2007,U.S. National Atlas Urbanized Areas represents urban areas in the United States derived from the urban areas layer of the Digital Chart of the World (DCW).,Polygon,Geological Survey (U.S.),Shapefile,2001,2005-2009,United States,Cities and towns,"ENVELOPE(-165.447891, -66.986388, 64.856135, 19.191791)"
8213,vector_public:TG00CAKGL,"UA Census Key Geographic Locations, 2000 - California","This datalayer displays Key Geographic Locations (KGLs), as defined by the US Census Bureau, throughout the state of California. Essential attribute data included are KGL Name and Census Feature Class Code (CFCC). Predominant features represented in this layer include: Airports or airfields; Custodial Facility (hospital, orphanage, Federal penitentiary, state prison); Educational or Religious Institution (convent or monastery, educational institution, religious institution); Multihousehold or Transient Quarters (apartment buildings and complexes, trailer courts or mobile home parks, campground, hotels, motels); Shopping centers or major retail centers; Transportation Terminal (train station, bus or marine terminal). Please note that many other feature types may be present in this layer. Key geographic locations (KGLs) represent a special class of address information. They provide a geocoding tool like address ranges, but also identify a spatial object similar to a landmark. The Census Bureau uses KGLs to identify named buildings where the use of the feature name enhances the ability to geocode addresses. These cases include airports, shopping centers, schools, condominiums, hotels, and apartment complexes. Even though the KGLs appear to identify specific structures, the KGL descriptions do not include location coordinates. In most cases, the Census Bureau can determine the general location of the KGL, but cannot provide a specific location with any certainty. The Census Bureau includes landmarks in the Census TIGER data base for locating special features and to help enumerators during field operations. The Census Bureau added landmark features on an as-needed-basis and made no attempt to ensure that all instances of a particular feature were included. The absence of a landmark does not mean that the living quarters, e.g., hospitals and group quarters associated with the landmark were excluded from the 1990 enumeration. A landmark can be a point, line, or area type. In some cases, the Census TIGER data base permits a choice of types. For instance, an airport or airfield might appear as a point, line, or area; the approach depends on the size of the feature and the depiction of the feature in the source document. Line features such as airfields could appear as one or more complete chains; they are not identified in the landmark record types A census feature class code (CFCC) is used to identify the most noticeable characteristic of a feature. The CFCC is applied only once to a chain or landmark with preference given to classifications that cover features that are visible to an observer and a part of the ground transportation network. Thus, a road that also is the boundary of a town would have a CFCC describing its road characteristics, not its boundary characteristics. The CFCC, as used in the TIGER/Line files, is a three-character code. The first character is a letter describing the feature class; the second character is a number describing the major category; and the third character is a number describing the minor category. Landmark (Feature Class D) is the general name given to a cartographic (or locational) landmark, a land-use area, and a key geographic location. A cartographic landmark is identified for use by an enumerator while working in the field. A land-use area is identified in order to minimize enumeration efforts in uninhabited areas or areas where human access is restricted. A key geographic location is identified in order to more accurately geocode and enumerate a place of work or residence.",Polygon,"U.S. Department of Commerce, Bureau of the Census, Geography Division",Shapefile,2000,2005-2009,California,transportation,"ENVELOPE(-124.230411002574, -115.277944998598, 41.9524609987704, 32.5517179991462)"
8214,vector_restricted:ARCGASEN,Atlanta Regional Commission Georgia State Senate Districts,"This polygon datalayer depicts the State of Georgia's Senatorial Districts as adopted by the Georgia General Assembly in 1999. Used to delineate voter districts for the Georgia General Assembly, this Theme may also be linked to the U.S. Census Bureau's Summary Tape Files (STF) for the display and analysis of demographic data.",Polygon,Atlanta Regional Commission (ARC),Shapefile,1999,2005-2009,Atlanta,boundaries,"ENVELOPE(-85.605164, -80.742569, 35.000771, 30.355644)"
8216,vector_restricted:KNG_WHPA5,"King County, Washington : wellhead protection areas (five year time of travel)","King County, Washington wellhead protection areas where contamination can flow into the well over a 5 year travel time.",Polygon,King County (Wash.),Shapefile,2001,2005-2009,Washington,Municipal,"ENVELOPE(-122.519212, -121.314696, 47.778474, 47.168141)"
8236,vector_public:TG95ORLKHLN,"Census Hydrographic Features, 1995 - Oregon","This datalayer displays the hydrographic features throughout the state of Oregon. This category includes shorelines of all water regardless of the classification of the water itself. Predominant features represented in this layer have Census Feature Class Codes (CFCCs) of: H01 (Shoreline of perennial water feature); H11 (Perennial stream or river); H12 (Intermittent stream, river, or wash). The Feature Name attribute further identifies water bodies as rivers, reservoirs, creeks, branches, forks, etc.",Line,"U.S. Department of Commerce, Bureau of the Census, Geography Division",Shapefile,1995,2005-2009,Oregon,inlandWaters,"ENVELOPE(-124.703541, -116.463815, 46.293145, 41.991877)"
8243,vector_public:GLB_DANGER,Global GIS : Hydrography danger points,"This datalayer is a point coverage representing worldwide navigational hazards or dangers near ocean and navigable lake coastlines and was published as part of the USGS Global GIS : global coverage database. Features in this layer have a FACC (Feature and Attribute Coding Catalogue) Codes of either BD130, defined as, 'Rock; An isolated rocky formation or a single large stone above or below the water surface,' or BD180, 'Wreck; The ruined remains of a vessel.' The datalayer was derived from the National Imagery and Mapping Agency's (NIMA, now the Nation Geospatial-Intelligence Agency (NGA)) Vector Map (VMap) Level 0 database (1997). The USGS Global GIS database contains a wealth of USGS and other public domain data, including global coverages of elevation, landcover, seismicity, and resources of minerals and energy at a nominal scale of 1:1 million. The U.S. Geological Survey (USGS) and The American Geological Institute (AGI) announced a cooperative agreement that will focus on making the USGS Global Geographic Information System (GIS) database readily available to educators and the general public in the form of a DVD based world atlas. The Vector Map (VMap) Level 0 database represents the third edition of the Digital Chart of the World. The second edition was a limited release item published 1995 09. The product is dual named to show its lineage to the original DCW, published in 1992, while positioning the revised product within a broader emerging-family of VMap products. VMap Level 0 is a comprehensive 1:1,000,000 scale vector basemap of the world. It consists of cartographic, attribute, and textual data stored on compact disc read only memory (CD-ROM). The primary source for the database is the National Imagery and Mapping Agency's (NIMA) Operational Navigation Chart (ONC) series. This is the largest scale unclassified map series in existence that provides consistent, continuous global coverage of essential basemap features. The database contains more than 1,900 megabytes of vector data and is organized into 10 thematic layers. The data includes major road and rail networks, major hydrologic drainage systems, major utility networks (cross-country pipelines and communication lines), all major airports, elevation contours (1000 foot(ft), with 500ft and 250ft supplemental contours), coastlines, international boundaries and populated places. The database can be accessed directly from the four optical CD-ROMs that store the database or can be transferred to a magnetic media.",Point,United States. National Imagery and Mapping Agency,Shapefile,1997,2005-2009,Earth,Hydrography,"ENVELOPE(-180, 180, 71.41378, -54.932495)"
8268,vector_restricted:ESRI05USDTL_RIVERS_AL,ESRI Data & Maps 2005 : U.S. Rivers and Streams : Alabama,U.S. Rivers and Streams : Alabama represents detailed rivers and streams for the state of Alabama.,Line,Geological Survey (U.S.),Shapefile,2004,2005-2009,Alabama,Rivers,"ENVELOPE(-88.472964, -84.888349, 35.008022, 30.225552)"
8272,vector_public:MGISMRDA2,MassGIS 2003 Massachusetts Highway Department Roads (December 2002),"This datalayer represents linework from the USGS 1:100,000 Roads Digital Line Graphs (DLGs) with additional linework from the Massachusetts Highway Department (MHD). Many of the new roads were provided to MHD by municipalities on various town-scale maps. Also, MHD made edits to existing DLG features, in many cases using the MassGIS 1:5,000 digital orthophotography as a backdrop to better spatially position the linework. In addition, this layer includes extensive attribute information maintained by the MHD which has been linked to all features. The layer is up-to-date through 2001. By late 2003 the linework in this datalayer will be replaced with 1:5,000 Road Centerlines that were interpreted as part of the Digital Orthophoto development project. The MHD inventory and street attribute data will then be attached (conflated) to the larger-scale mapping.",Line,MassGIS (Office : Mass.),Shapefile,2001,2005-2009,Massachusetts,Transportation,"ENVELOPE(-73.521297, -69.909337, 42.88831, 41.231483)"
8273,vector_restricted:ESRI06USBLKPOP_FL,ESRI Data & Maps 2006 : U.S. Census Block Centroid Populations : Florida,U.S. Census Block Centroid Populations : Florida represents the populations of the U.S. Census blocks for the state of Florida. U.S. Census blocks are the smallest geographic entities within a county for which the Census Bureau tabulates population.,Point,"Tele Atlas North America, Inc.",Shapefile,2004,2005-2009,Florida,Census,"ENVELOPE(-87.626181, -79.991041, 31.000541, 24.49104)"
8306,vector_restricted:ESRI05USBLKPOP_VT,ESRI Data & Maps 2005 : U.S. Census Block Centroid Populations : Vermont,U.S. Census Block Centroid Populations : Vermont represents the population of the U.S. Census block centroids for the state of Vermont. U.S. Census blocks are the smallest geographic entities within a county for which the Census Bureau tabulates population.,Point,"Environmental Systems Research Institute (Redlands, Calif.)",Shapefile,2000,2005-2009,Vermont,Census,"ENVELOPE(-73.420575, -71.485015, 45.014874, 42.730026)"
8309,vector_restricted:ESRI05WLDCOUNTRY,ESRI Data & Maps 2005 : World Countries (Generalized),"World Countries (Generalized) represents generalized boundaries for the countries of the world, as they existed in January 2005.",Polygon,"Environmental Systems Research Institute (Redlands, Calif.)",Shapefile,1996,2005-2009,Earth,Boundaries,"ENVELOPE(-180, 180, 83.604159, -90)"
8312,vector_restricted:ESRI04USRAIL100K,ESRI Data & Maps 2004 : U.S. National Transportation Atlas Railroads,"U.S. National Transportation Atlas Railroads represents a comprehensive database of the nation's railway system at 1:100,000 scale. The data set covers the 48 contiguous States plus the District of Columbia within United States.",Line,United States. Federal Railroad Administration,Shapefile,2002,2005-2009,United States,Railroads,"ENVELOPE(-124.258491, -67.267955, 49.001882, 25.462464)"
8319,vector_restricted:ESRI04CANMUNICP,ESRI Data & Maps 2004 : Canada Municipalities,"Canada Municipalities represents the municipalities within Canada of types including cities, cantons, hamlets, towns/ville, villages, Indian reserves, parishes/paroisse, communities, unorganized, districts, and terre Inuite. The boundaries are digitized from CanMap.",Polygon,DMTI Spatial Inc.,Shapefile,2002,2005-2009,Canada,Cities and towns,"ENVELOPE(-141.002118, -52.619173, 83.115063, 41.687973)"
8321,vector_restricted:ESRI07EURNUTS0,Europe NUTS 0 Demographics : ESRI Data & Maps 2007,Europe NUTS 0 Demographics represents areas of aggregated socioeconomic and demographic information at the NUTS 0 (country) level for Europe. NUTS (Nomenclature des Unit?s Territoriales Statistiques) refers to the Nomenclature of Territorial Units for Statistics. For more information: http://europa.eu.int/comm/eurostat/ramon/nuts/introduction_regions_en.html.,Polygon,Michael Bauer Research GmbH,Shapefile,2007,2005-2009,Europe,Demography,"ENVELOPE(-31.268789, 69.068487, 81.8602, 27.638029)"
8349,vector_restricted:ESRI05USBLKPOP_DE,ESRI Data & Maps 2005 : U.S. Census Block Centroid Populations : Delaware,U.S. Census Block Centroid Populations : Delaware represents the population of the U.S. Census block centroids for the state of Delaware. U.S. Census blocks are the smallest geographic entities within a county for which the Census Bureau tabulates population.,Point,"Environmental Systems Research Institute (Redlands, Calif.)",Shapefile,2000,2005-2009,Delaware,Census,"ENVELOPE(-75.788245, -75.026145, 39.838698, 38.451338)"
8354,vector_restricted:ESRI06USBLKPOP_AR,ESRI Data & Maps 2006 : U.S. Census Block Centroid Populations : Arkansas,U.S. Census Block Centroid Populations : Arkansas represents the populations of the U.S. Census blocks for the state of Arkansas. U.S. Census blocks are the smallest geographic entities within a county for which the Census Bureau tabulates population.,Point,"Tele Atlas North America, Inc.",Shapefile,2004,2005-2009,Arkansas,Census,"ENVELOPE(-94.617801, -89.647287, 36.499185, 33.005495)"
8358,vector_public:TG00CALKF,"UA Census Non-Visible Boundaries, 2000 - California","This datalayer displays the non-visible features for the state of California. This layer contains various types of nonvisible lines used to maintain the topology in the Census TIGER database. Non-visible features are used to delimit tabulation entities, property areas, legal and administrative entities. The U.S. Census Bureau separately identifies non-visible boundaries only when they do not follow a visible feature such as a road, stream, or ridge line. The predominant Census Feature Class Codes (CFCC) in this layer include: F10 (Non-visible jurisdictional boundary of a legal or administrative entity); F23 (Closure extension to complete database topological closure between extremely close features - used to close small gaps between complete chains and create polygons to improve block labeling on cartographic products); F40 (Property line, non-visible boundary of either public or private lands, e.g., a park boundary); F71 (1980 statistical boundary); F72 (1990 statistical boundary; used to hold 1990 collection and tabulation census block boundaries not represented by existing physical features); F73 (Internal U.S. Census Bureau use) and F81 (School district boundary).",Line,"U.S. Department of Commerce, Bureau of the Census, Geography Division",Shapefile,2000,2005-2009,California,imageryBaseMapsEarthCover,"ENVELOPE(-124.470153, -114.131211, 42.009518, 32.528832)"
8363,vector_public:GLB_GAZPPE,"Global GIS : Gazetteer of populated places, Eastern Hemisphere","This datalayer is a point coverage representing a gazetteer of populated place features located between the Greenwich meridian (0 degrees) and 180 degrees east of the Greenwich meridian, encompassing the Eastern Hemisphere, excluding Antarctica. Features and attributes were derived from the GNS (GEOnet Names Server) and include populated place names. The GEOnet Names Server provides access to the National Geospatial-Intelligence Agency's (NGA) (formerly the National Imagery and Mapping Agency (NIMA)) database of foreign geographic feature names. Approximately 20,000 of the database's 3.5 million features are updated monthly with names information approved by the U.S. Board on Geographic Names (US BGN). The USGS Global GIS database contains a wealth of USGS and other public domain data, including global coverages of elevation, landcover, seismicity, and resources of minerals and energy at a nominal scale of 1:1 million. The U.S. Geological Survey (USGS) and The American Geological Institute (AGI) announced a cooperative agreement that will focus on making the USGS Global Geographic Information System (GIS) database readily available to educators and the general public in the form of a DVD based world atlas.",Point,United States. National Geospatial-Intelligence Agency,Shapefile,2003,2005-2009,Eastern Hemisphere,"Names, Geographical","ENVELOPE(0, 180, 86.216667, -49.349998)"
8371,vector_public:AFRICOVER_SM_SPAT_AGG,Somalia Spatially Aggregated Multipurpose Landcover Database,"Somalia spatially aggregated multipurpose landcover database from The Multipurpose Africover Database for the Environmental Resources produced by the Food and Agriculture Organization of the United Nations (FAO). Scale of the dataset: 1:200,000. This dataset is a spatially reaggregated version of the original national Africover landcover multipurpose database. The land cover has been produced from visual interpretation of digitally enhanced LANDSAT TM images (Bands 4,3,2) acquired mainly in the year 1995 - 1998. The land cover classes have been developed using the FAO/UNEP international standard LCCS classification system.",Polygon,Food and Agriculture Organization of the United Nations,Shapefile,2002,2005-2009,Somalia,Land use,"ENVELOPE(40.898697, 51.412724, 11.992188, -1.734619)"
8379,vector_restricted:ESRI06USBLKPOP_MD,ESRI Data & Maps 2006 : U.S. Census Block Centroid Populations : Maryland,U.S. Census Block Centroid Populations : Maryland represents the populations of the U.S. Census blocks for the state of Maryland. U.S. Census blocks are the smallest geographic entities within a county for which the Census Bureau tabulates population.,Point,"Tele Atlas North America, Inc.",Shapefile,2004,2005-2009,Maryland,Census,"ENVELOPE(-79.4866, -75.050579, 39.722716, 37.914194)"
8389,vector_restricted:KNG_SNSTRT,"King County, Washington : streets (geocoding)","Line features derived from the King County, Washington street network coverage (kcsn) with a denormalized attribute table. Covers also portions of Snohomish and Pierce Counties.",Line,King County (Wash.),Shapefile,2003,2005-2009,Washington,Municipal,"ENVELOPE(-122.83652, -121.083837, 48.306639, 46.738305)"
8391,vector_restricted:ARCEXWY,Atlanta Regional Commission Expressways,This polyline datalayer depicts all interstate highways in the Atlanta Region and Georgia Highway 400. This Theme is a subset of ARC's street centerline database. The features included in this Theme were identified by ARC's Transportation Planning Division.,Line,Atlanta Regional Commission (ARC),Shapefile,2000,2005-2009,Atlanta,transportation,"ENVELOPE(-84.911362, -83.83287, 34.37347, 33.298332)"
8393,vector_restricted:LI_MADRID_RD,"Madrid, Spain : Street Centerlines, 2005","Madrid, Spain street centerline vectors with road type attributes extracted from DigitalGlobe QuickBird CitySphere high-resolution (60cm) satellite imagery ortho mosaics.",Line,Land Info (Firm),Shapefile,2005,2005-2009,Spain,Transportation,"ENVELOPE(-3.828543, -3.527997, 40.536825, 40.278044)"
8399,vector_restricted:ESRI05USBLKPOP_MT,ESRI Data & Maps 2005 : U.S. Census Block Centroid Populations : Montana,U.S. Census Block Centroid Populations : Montana represents the population of the U.S. Census block centroids for the state of Montana. U.S. Census blocks are the smallest geographic entities within a county for which the Census Bureau tabulates population.,Point,"Environmental Systems Research Institute (Redlands, Calif.)",Shapefile,2000,2005-2009,Montana,Census,"ENVELOPE(-116.04909, -104.042063, 49.000731, 44.444995)"
8402,vector_restricted:ESRI06USBLKPOP_SC,ESRI Data & Maps 2006 : U.S. Census Block Centroid Populations : South Carolina,U.S. Census Block Centroid Populations : South Carolina represents the populations of the U.S. Census blocks for the state of South Carolina. U.S. Census blocks are the smallest geographic entities within a county for which the Census Bureau tabulates population.,Point,"Tele Atlas North America, Inc.",Shapefile,2004,2005-2009,South Carolina,Census,"ENVELOPE(-83.340948, -78.543574, 35.21215, 32.061479)"
8409,vector_restricted:ESRI04USINSTITUT,ESRI Data & Maps 2004 : U.S. GDT Institutions,"U.S. GDT Institutions represents point locations within United States for common institution landmark types including hospitals, educational institutions, religious institutions, government centers, and cemeteries.",Point,"Geographic Data Technology, Inc. (GDT)",Shapefile,2002,2005-2009,United States,Hospitals,"ENVELOPE(-165.450118, -65.972391, 64.878455, 17.996082)"
8417,vector_public:MGISNWIA,MassGIS 2003 Massachusetts National Wetlands Inventory (Arcs) (February 2003),"This layer contains arcs representing rivers and streams for the state for Massachusetts. The National Wetlands Inventory (NWI) project, administered by the U.S. Fish and Wildlife Service, was established to generate information about the characteristics, extent and status of the Nation's wetlands and deepwater habitats. This information is used by Federal, State, and local agencies, academic institutions, U.S. Congress, and the private sector. The Emergency Wetland Resources Act of 1986 directs the Service to map the wetlands of the United States. The NWI has mapped 89% of the lower 48 states, and 31% of Alaska. The Act also requires the Service to produce a digital wetlands database for the United States. About 39% of the lower 48 states and 11% of Alaska are digitized. Approximately 50 percent of Massachusetts is available in digital format. For full details on the national mapping project visit the National Wetlands Inventory web site: http://www.fws.gov/nwi/",Line,MassGIS (Office : Mass.),Shapefile,2003,2005-2009,Massachusetts,Wetlands,"ENVELOPE(-73.53063, -69.895669, 43.002513, 41.231279)"
8435,vector_restricted:NM_SD_1992_OUTLINE,New Mexico State Senate Districts 1992,The data represent the New Mexico State Senate Districts from 1992,Polygon,"Research & Polling, Inc.",Shapefile,1992,2005-2009,New Mexico,Administrative and political divisions,"ENVELOPE(-109.050173, -103.001964, 37.000293, 31.332172)"
8437,vector_public:TG95DELKFLN,"Census Non-Visible Features, 1995 - Delaware","This datalayer displays the non-visible features for the state of Delaware. This layer contains various types of nonvisible lines used to maintain the topology in the Census TIGER database. Non-visible features are used to delimit tabulation entities, property areas, legal and administrative entities. The U.S. Census Bureau separately identifies non-visible boundaries only when they do not follow a visible feature such as a road, stream, or ridge line. The predominant Census Feature Class Codes (CFCC) in this layer are: F10 (Non-visible jurisdictional boundary of a legal or administrative entity); F23 (Closure extension to complete database topological closure between extremely close features - used to close small gaps between complete chains and create polygons to improve block labeling on cartographic products); F40 (Property line, non-visible boundary of either public or private lands, e.g., a park boundary); F71 (1980 statistical boundary); F72 (1990 statistical boundary; used to hold 1990 collection and tabulation census block boundaries not represented by existing physical features); F73 (Internal U.S. Census Bureau use) and F81 (School district boundary).",Line,"U.S. Department of Commerce, Bureau of the Census, Geography Division",Shapefile,1995,2005-2009,Delaware,imageryBaseMapsEarthCover,"ENVELOPE(-75.788758, -74.984165, 39.839007, 38.451013)"
8449,vector_restricted:INDIAPOLL_MAHARASHTR,"Maharashtra, India : State Assembly Constituency Boundaries and Election Data, 1990-2004","This datalayer shows state Legislative Assembly constituency boundaries and data relating to the past four Assembly elections (1990, 1995, 1999, 2004) for the State of Maharashtra, India. Includes attribute data on election parties, candidates, voters, and results. This layer is part of the PollMap of India dataset published by ML InfoMap which includes parliamentary constituency boundaries for India, Assembly constituency boundaries for all states, and data relating to the past four national elections for each State of India. This data layer is sourced from secondary government sources, chiefly Survey of India, Census of India, Election Commission, etc. Scale 1:1,000,000.",Polygon,ML InfoMap (Firm),Shapefile,1990,2005-2009,India,Administrative and political divisions,"ENVELOPE(72.640381, 80.911087, 22.029032, 15.589839)"
8454,vector_restricted:ESRI04USINTRSTAT,ESRI Data & Maps 2004 : U.S. National Transportation Atlas Interstate Highways,U.S. National Transportation Atlas Interstate Highways represents rural and urban interstate highways. U.S. National Transportation Atlas Interstate Highways is part of the National Highway Planning Network version 4.0 (line) published by the Federal Highway Administration as part of the National Transportation Atlas Databases for the United States.,Line,United States. Bureau of Transportation Statistics,Shapefile,2002,2005-2009,United States,Express highways,"ENVELOPE(-158.090073, -67.781191, 64.888218, 21.273109)"
