Column,layerid,title,description,layertype,creator,format,date,desc_date,place,subject,bbox
5190,vector_public:TG95DECCDCUPY,"Census County Divisions and Minor Civil Divisions, 1995 - Delaware","This datalayer displays Census County Divisions and Minor Civil Divisions for the entire state of Delaware. Census County Divisions (CCDs) are county subdivisions that were delineated by the U.S. Census Bureau, in cooperation with state and local government officials for data presentation purposes. CCDs have been established in 21 states where there are no legally established minor civil divisions (MCDs), where the MCDs do not have governmental or administrative purposes, where the boundaries of the MCDs are ambiguous or change frequently, and/or where the MCDs generally are not known to the public. CCDs have no legal functions and are not governmental units. The boundaries of CCDs usually are delineated to follow visible features and coincide with census tracts where applicable. (In a few instances, two CCDs may constitute a single census tract.) The name of each CCD is based on a place, county, or well-known local name that identifies its location. Minor Civil Divisions (MCDs) are the primary governmental or administrative divisions of a county in many states (parish in Louisiana). MCDs represent many different kinds of legal entities with a wide variety of governmental and/or administrative functions. NOTE: The U.S. Census Bureau does not recognize MCDs for Delaware.",Polygon,"U.S. Department of Commerce, Bureau of the Census, Geography Division",Shapefile,1995,2005-2009,Delaware,boundaries,"ENVELOPE(-75.788758, -75.048413, 39.839007, 38.451013)"
5201,vector_restricted:CH2000_L_F,China county boundary with 2000 population Census data from 9.5% Long Form data (Part F: Tables L7-4 to L7-8),"This polygon datalayer includes China county boundary with 2000 population Census data from 9.5% Long Form data. This layer is one (Part F) of seven layers (see also Parts A-E and G) covering the entire Long Form data; this layer covers Long Form tables L7-4 to L7-8: L7-4: Population by current residence and former residence 5 years ago; L7-6-1: Population by current residence, type of emigration place and education attainment (intra-region); L7-6-2: Population by current residence, type of emigration place and education attainment (inter-region); L7-7-1: Population by current residence, emigration place and occupation (intra-region); L7-7-2: Population by current residence, emigration place and occupation (inter-region); L7-8: Women having births by current residence, place of household registration and birth order (1999 11.l - 2000.10.31). This datalayer is part of the China 2000 county population census data set produced by the All China Marketing Research Co. and distributed by the University of Michigan, China Data Center (2003). The new version (III) of 2000 county data include 2000 county boundary GIS map and several other GIS maps, integrated with more than 1,900 variables from 2000 population census data for counties and urban districts. Source scale: 1:1,000,000.",Polygon,Beijing Hua tong ren shi chang xin xi you xian ze ren gong si,Shapefile,2000,2005-2009,China,Census,"ENVELOPE(73.44696, 135.085831, 53.557926, 6.318641)"
5203,vector_restricted:ESRI05USLALNDMRK,ESRI Data & Maps 2005 : U.S. TANA/GDT Large Area Landmarks,"U.S. TANA/GDT Large Area Landmarks represents common landmark areas within United States including military areas, prisons, educational institutions, amusement centers, government centers, sport centers, golf courses, and cemeteries.",Polygon,"Tele Atlas North America, Inc.",Shapefile,2004,2005-2009,United States,Military bases,"ENVELOPE(-176.810434, -65.986472, 68.87001, 17.987398)"
5206,vector_restricted:ESRI04USZIP_POLY,ESRI Data & Maps 2004 : U.S. ZIP Code Areas,"U.S. ZIP Code Areas represents five-digit ZIP Code areas used by the U.S. Postal Service to deliver mail more effectively. The first digit of a five-digit ZIP Code divides the country into 10 large groups of states numbered from 0 in the Northeast to 9 in the far West. Within these areas, each state is divided into an average of 10 smaller geographical areas, identified by the 2nd and 3rd digits. These digits, in conjunction with the first digit, represent a sectional center facility or a mail processing facility area. The 4th and 5th digits identify a post office, station, branch or local delivery area.",Polygon,"Geographic Data Technology, Inc.",Shapefile,2003,2005-2009,United States,Zip codes,"ENVELOPE(-178.226727, -66.952936, 71.357355, 18.916073)"
5220,vector_public:TG95DEUNIPY,"Census Unified School Districts, 1995 - Delaware","This datalayer displays the Unified School Districts for the entire state of Delaware. A unified school district is inclusive of kindergarten through twelfth grade. The Census Bureau defines a school district as the territory administered by the elected or appointed authorities of a state, county, or other local governmental unit to provide educational services to a resident population. A school district typically includes several school buildings, teachers, and related staff. The Census Bureau provided data tabulations for school districts from the 1970, 1980, and 1990 censuses.",Polygon,"U.S. Department of Commerce, Bureau of the Census, Geography Division",Shapefile,1995,2005-2009,Delaware,boundaries,"ENVELOPE(-75.788758, -75.048413, 39.839007, 38.451013)"
5226,vector_restricted:ESRI04USDTL_WAT,ESRI Data & Maps 2004 : U.S. Water Bodies,"U.S. Water Bodies represents the major lakes, reservoirs, large rivers, lagoons and estuaries in the United States.",Polygon,Geological Survey (U.S.),Shapefile,1999,2005-2009,United States,Bodies of water,"ENVELOPE(-160.231109, -66.997864, 49.384336, 19.641173)"
5236,vector_restricted:ESRI07USDTL_ST,U.S. States : ESRI Data & Maps 2007,"U.S. States represents the 50 states, the District of Columbia, and Puerto Rico of the United States.",Polygon,"Tele Atlas North America, Inc.",Shapefile,2007,2005-2009,United States,States,"ENVELOPE(-178.227822, -65.244234, 71.390482, 17.881242)"
5240,vector_restricted:ESRI07WLDCNTRY07_LN,World Country Boundaries : ESRI Data & Maps 2007,World Country Boundaries represents the boundary lines for the countries of the world.,Line,"Environmental Systems Research Institute (Redlands, Calif.)",Shapefile,1996,2005-2009,Earth,Boundaries,"ENVELOPE(-180, 180, 83.623596, -85.470291)"
5257,vector_restricted:INDIAPOLL_BIHAR,"Bihar, India : State Assembly Constituency Boundaries and Election Data, 1985-2005","This datalayer shows state Legislative Assembly constituency boundaries and data relating to the past five Assembly elections (1985, 1990, 1995, 2000, Feb. 2005 & Oct. 2005) for the State of Bihar, India. Includes attribute data on election parties, candidates, voters, and results. This layer is part of the PollMap of India dataset published by ML InfoMap which includes parliamentary constituency boundaries for India, Assembly constituency boundaries for all states, and data relating to the past four national elections for each State of India. This data layer is sourced from secondary government sources, chiefly Survey of India, Census of India, Election Commission, etc. Scale 1:1,000,000.",Polygon,ML InfoMap (Firm),Shapefile,1985,2005-2009,India,Administrative and political divisions,"ENVELOPE(83.33773, 88.276863, 27.520844, 24.289936)"
5267,vector_restricted:ESRI04POLORG04,ESRI Data & Maps 2004 : World Country Memberships of Political Organizations,"This polygon layer joins the World Country Memberships of Political Organizations attribute table to the ESRI Data & Maps 2004 : World Countries 2004 datalayer, to enable spatial displaying of World Country Memberships of Political Organizations attributes. World Country Memberships of Political Organizations (table) represents the memberships of countries in world political organizations such as the Untied Nations, the International Monetary Fund (IMF), and the Food and Agriculture Organization (FAO).",Polygon,United States. Central Intelligence Agency,Shapefile,2000,2005-2009,Earth,International cooperation,"ENVELOPE(-180, 180, 83.6236, -90)"
5274,vector_restricted:ESRI07CANMDCITIES,Canada Middle Cities : ESRI Data & Maps 2007,Canada Middle Cities represents the locations of populated places within Canada.,Point,DMTI Spatial Inc.,Shapefile,2007,2005-2009,Canada,Cities and towns,"ENVELOPE(-135.205043, -52.680729, 60.824059, 42.006569)"
5278,vector_restricted:ESRI05USDTL_RIVERS_NY,ESRI Data & Maps 2005 : U.S. Rivers and Streams : New York,U.S. Rivers and Streams : New York represents detailed rivers and streams for the state of New York.,Line,Geological Survey (U.S.),Shapefile,2004,2005-2009,New York,Rivers,"ENVELOPE(-79.762089, -71.871482, 45.013384, 40.512756)"
5281,vector_public:TG95ALCDCPY,"Congressional Districts, 1995 - Alabama","The polygons represent Congressional districts (104th Congress) for the state of Alabama. Congressional districts (CDs) are the 435 areas from which people are elected to the U.S. House of Representatives. After the apportionment of congressional seats among the states, based on census population counts, each state is responsible for establishing CDs for the purpose of electing representatives. Each CD is to be as equal in population to all other CDs in the state as practicable. The CDs of the 103rd Congress (January 1993 to 1995) were the first to reflect redistricting based on the 1990 census. These CD boundaries and numbers will remain in effect until after Census 2000, except where a state initiative or a court-ordered redistricting had required a change. Six states were redistricted for the 104th Congress (Georgia, Louisiana, Maine, Minnesota, South Carolina, and Virginia).",Polygon,"U.S. Department of Commerce, Bureau of the Census, Geography Division",Shapefile,1995,2005-2009,Alabama,boundaries,"ENVELOPE(-88.473227, -84.888967, 35.007882, 30.194045)"
5295,vector_restricted:ESRI04DCBLKPOP,ESRI Data & Maps 2004 : U.S. Census Block Centroid Populations : District of Columbia,U.S. Census Block Centroid Populations : District of Columbia represents the population of the U.S. Census block centroids for the District of Columbia. U.S. Census blocks are the smallest geographic entities within a county for which the Census Bureau tabulates population.,Point,"Environmental Systems Research Institute (Redlands, Calif.)",Shapefile,2003,2005-2009,District of Columbia,Census,"ENVELOPE(-77.119127, -76.910182, 38.993364, 38.792764)"
5300,vector_restricted:INDIAVILL_RAJSTHAN,"Rajasthan, India : Village Socio-Demographic and Economic Census Data, 2001","This datalayer shows village locations with socio-demographic and economic Census data for 2001 for the state of Rajasthan, India. Includes village socio-demographic and economic Census attribute data such as total population, population by sex, household, literacy and illiteracy rates, and employment by industry. This layer is part of the VillageMap dataset which includes socio-demographic and economic Census data for 2001 at the village level for all the states of India. This data layer is sourced from secondary government sources, chiefly Survey of India, Census of India, Election Commission, etc. Scale 1:1,000,000.",Point,ML InfoMap (Firm),Shapefile,2001,2005-2009,India,Human settlements,"ENVELOPE(69.523003, 78.265549, 30.139835, 23.067652)"
5301,vector_public:TG00NELKF,"UA Census Non-Visible Boundaries, 2000 - Nebraska","This datalayer displays the non-visible features for the state of Nebraska. This layer contains various types of nonvisible lines used to maintain the topology in the Census TIGER database. Non-visible features are used to delimit tabulation entities, property areas, legal and administrative entities. The U.S. Census Bureau separately identifies non-visible boundaries only when they do not follow a visible feature such as a road, stream, or ridge line. The predominant Census Feature Class Codes (CFCC) in this layer include: F10 (Non-visible jurisdictional boundary of a legal or administrative entity); F23 (Closure extension to complete database topological closure between extremely close features - used to close small gaps between complete chains and create polygons to improve block labeling on cartographic products); F40 (Property line, non-visible boundary of either public or private lands, e.g., a park boundary); F71 (1980 statistical boundary); F72 (1990 statistical boundary; used to hold 1990 collection and tabulation census block boundaries not represented by existing physical features); F73 (Internal U.S. Census Bureau use) and F81 (School district boundary).",Line,"U.S. Department of Commerce, Bureau of the Census, Geography Division",Shapefile,2000,2005-2009,Nebraska,imageryBaseMapsEarthCover,"ENVELOPE(-104.053514, -95.30829, 43.001708, 39.999998)"
5315,vector_restricted:ESRI06MXCITY,ESRI Data & Maps 2006 : Mexico Cities,Mexico Cities represents the locations of cities in Mexico.,Point,"Sistemas de Informacion Geografica, S.A.",Shapefile,2006,2005-2009,Mexico,Cities and towns,"ENVELOPE(-117.056064, -86.751671, 32.715241, 14.56306)"
5319,vector_restricted:ESRI03USAREACODE,ESRI Data & Maps 2003 : U.S. Telephone Area Code Boundaries,U.S. Telephone Area Code Boundaries represents the telephone area codes for United States. They are also known as Numbering Plan Areas (NPA).,Polygon,"Geographic Data Technology, Inc.",Shapefile,2002,2005-2009,United States,Telephone Area codes,"ENVELOPE(-178.229649, -66.949895, 71.381773, 18.910842)"
5334,vector_restricted:ESRI07WLDCITIES,World Cities : ESRI Data & Maps 2007,World Cities represents the locations of major cities of the world.,Point,"Environmental Systems Research Institute (Redlands, Calif.)",Shapefile,1996,2005-2009,Earth,Cities and towns,"ENVELOPE(-176.151564, 179.221888, 78.200001, -54.792)"
5339,vector_public:AFRICOVER_SM_GRASS_AGG,Somalia Thematic Grassland Aggregation Landcover,"Somalia thematic grassland aggregation landcover from The Multipurpose Africover Database for the Environmental Resources produced by the Food and Agriculture Organization of the United Nations (FAO). Scale of the dataset: 1:200,000. This dataset is a reaggregated version of the original national Africover landcover multipurpose database. It contains all natural vegetation with a herbaceous component. The land cover has been produced from visual interpretation of digitally enhanced LANDSAT TM images (Bands 4,3,2) acquired mainly in the year 1995 - 1998. The land cover classes have been developed using the FAO/UNEP international standard LCCS classification system.",Polygon,Food and Agriculture Organization of the United Nations,Shapefile,2002,2005-2009,Somalia,Land use,"ENVELOPE(40.89883, 51.250771, 11.9858, -1.734619)"
5358,vector_restricted:ESRI05USGHOSPITL,ESRI Data & Maps 2005 : U.S. Geographic Names Information System Hospitals,U.S. Geographic Names Information System Hospitals represents an automated inventory of the proper names and locations of physical and cultural geographic features located throughout the United States and its Territories.,Point,Geological Survey (U.S.),Shapefile,1981,2005-2009,United States,Hospitals,"ENVELOPE(-170.684433, 158.216382, 61.18889, -14.29528)"
5361,vector_restricted:ESRI07EURCITIES,Europe Cities : ESRI Data & Maps 2007,"Europe Cities represents the cities of Europe including national capitals, major population centers, and landmark cities.",Point,AND International Publishers N.V.,Shapefile,2006,2005-2009,Europe,Cities and towns,"ENVELOPE(-21.9614, 64.0749, 78.2079, 27.9956)"
5362,vector_public:AFRICOVER_RW_SPAT_AGG,Rwanda Spatially Aggregated Multipurpose Landcover Database,"Rwanda spatially aggregated multipurpose landcover database from The Multipurpose Africover Database for the Environmental Resources produced by the Food and Agriculture Organization of the United Nations (FAO). Scale of the dataset: 1:100,000. This dataset is a spatially reaggregated version of the original national Africover landcover multipurpose database. The land cover has been produced from visual interpretation of digitally enhanced LANDSAT TM images (Bands 4,3,2) acquired mainly in the year 1999. The land cover classes have been developed using the FAO/UNEP international standard LCCS classification system.",Polygon,Food and Agriculture Organization of the United Nations,Shapefile,2002,2005-2009,Rwanda,Land use,"ENVELOPE(28.771509, 30.989523, -0.963372, -2.93011)"
5372,vector_restricted:INDIAVILL_TAMIL,"Tamil Nadu, India : Village Socio-Demographic and Economic Census Data, 2001","This datalayer shows village locations with socio-demographic and economic Census data for 2001 for the state of Tamil Nadu, India. Includes village socio-demographic and economic Census attribute data such as total population, population by sex, household, literacy and illiteracy rates, and employment by industry. This layer is part of the VillageMap dataset which includes socio-demographic and economic Census data for 2001 at the village level for all the states of India. This data layer is sourced from secondary government sources, chiefly Survey of India, Census of India, Election Commission, etc. Scale 1:1,000,000.",Point,ML InfoMap (Firm),Shapefile,2001,2005-2009,India,Human settlements,"ENVELOPE(76.281067, 80.325089, 13.542293, 8.099716000000001)"
5376,vector_restricted:INDIAVILL_JHARKHAN,"Jharkhand, India : Village Socio-Demographic and Economic Census Data, 2001","This datalayer shows village locations with socio-demographic and economic Census data for 2001 for the state of Jharkhand, India. Includes village socio-demographic and economic Census attribute data such as total population, population by sex, household, literacy and illiteracy rates, and employment by industry. This layer is part of the VillageMap dataset which includes socio-demographic and economic Census data for 2001 at the village level for all the states of India. This data layer is sourced from secondary government sources, chiefly Survey of India, Census of India, Election Commission, etc. Scale 1:1,000,000.",Point,ML InfoMap (Firm),Shapefile,2001,2005-2009,India,Human settlements,"ENVELOPE(83.350212, 87.917763, 25.323095, 21.972181)"
5402,vector_restricted:KNG_UGAREA,"King County, Washington : urban growth area, 2002","King County, Washington urban growth area (UGA) with changes through September 2002. The Comprehensive Plan designates an UGA which includes areas and densities sufficient to permit the urban growth that is projected to occur in the County for the succeeding 20-year period.",Polygon,King County (Wash.),Shapefile,2002,2005-2009,Washington,Municipal,"ENVELOPE(-122.542304, -121.061526, 47.788236, 47.073933)"
5414,vector_restricted:ESRI06USVOLCANO,ESRI Data & Maps 2006 : U.S. National Atlas Volcanoes,"U.S. National Atlas Volcanoes represents volcanoes thought to be active in the last 10,000 years (Holocene), in and near the United States. The data is a subset of data available from the Global Volcanism Program, Smithsonian Institution.",Point,Geological Survey (U.S.),Shapefile,2005,2005-2009,United States,Volcanoes,"ENVELOPE(-178.792618, 179.577271, 65.599282, 10.03)"
5446,vector_public:TG95DELPTPT,"Census Landmark Points, 1995 - Delaware","This datalayer displays landmark point features throughout the state of Delaware. 'Landmark' is the general name given to a cartographic (or locational) landmark, a land-use area, and a key geographic location (KGL). A cartographic landmark is identified for use by an enumerator while working in the field. A land-use area is identified in order to minimize enumeration efforts in uninhabited areas or areas where human access is restricted. A key geographic location is identified in order to more accurately geocode and enumerate a place of work or residence. The predominant feature classes represented in this layer include airports or airfields, cemeteries, fraternities or sororities, state or local parks or forests, golf courses, lookout towers, educational and religious institutions. Other possible landmark features could include military installations, multi-household or transient quarters, custodial facilities, other types of transportation facilities or terminals, employment centers, open space and other special landmark designations for post offices, police stations and firehouses.",Point,"U.S. Department of Commerce, Bureau of the Census, Geography Division",Shapefile,1995,2005-2009,Delaware,transportation,"ENVELOPE(-75.746458, -75.062559, 39.5894, 38.453054)"
5476,vector_restricted:ESRI07CANMJCITIES,Canada Major Cities : ESRI Data & Maps 2007,"Canada Major Cities represents the locations of major cities within Canada. A major city is defined as: a populated place that has been designated as a provincial or federal capital by Statistics Canada, or a populated place that has been designated as a city by Natural Resources Canada and has a population greater than 100,000.",Point,DMTI Spatial Inc.,Shapefile,2007,2005-2009,Canada,Cities and towns,"ENVELOPE(-135.05242, -52.712675, 63.746693, 42.317438)"
5478,vector_restricted:ESRI05EURPROV2,ESRI Data & Maps 2005 : Europe Level 2 Provinces,Europe Level 2 Provinces represents the second level of sub-national administrative units for countries in Europe.,Polygon,AND International Publishers N.V.,Shapefile,2004,2005-2009,Europe,Administrative and political divisions,"ENVELOPE(-31.2716, 68.7161, 81.8602, 27.6374)"
5510,vector_restricted:ESRI06USBLKPOP_HI,ESRI Data & Maps 2006 : U.S. Census Block Centroid Populations : Hawaii,U.S. Census Block Centroid Populations : Hawaii represents the populations of the U.S. Census blocks for the state of Hawaii. U.S. Census blocks are the smallest geographic entities within a county for which the Census Bureau tabulates population.,Point,"Tele Atlas North America, Inc.",Shapefile,2004,2005-2009,Hawaii,Census,"ENVELOPE(-178.3333, -154.81618, 28.42051, 18.911937)"
5511,vector_restricted:ARCFEZCEN,Atlanta Regional Commission Federal Empowerment Zone Census Tracts,This polygon datalayer depicts the subset of the 1990 ARC Census Tracts that have the official designation of being a part of the Federal Empowerment Zone and are within the Atlanta Regional Commission's (ARC) 10-county region.,Polygon,Atlanta Regional Commission (ARC),Shapefile,1990,2005-2009,Atlanta,boundaries,"ENVELOPE(-84.417328, -84.352821, 33.782806, 33.697006)"
5520,vector_public:DCW_CL_LINE,"DCW Cultural Landmarks, Lines","This datalayer is a polyline coverage representing cultural landmarks located throughout DCW (Digital Chart of the World) geographic coverage as of 1992. Features here may include: Weir, jetty, groyne; Boat ramp; Pier, wharf, quay; breakwater; Aerial cableway; Wall, trench, tank trap; Prominent fence; Dams*. *The dams in this layer are those shown on the ONC with their true shape and extent. Those dams that are represented only by a graphic symbol are present as point data in the Drainage layer. All dams in this layer are also represented as points in Drainage Point coverage. These features are not always coincident with inland water shorelines. This layer was derived from the VMAP0 series produced by the National Geospatial-Intelligence Agency (NGA), formerly known as NIMA (National Imagery and Mapping Agency), an agency of the United States government. VMAP data set products use the 'vector product format' (vpf). The term 'VMap' is derived from 'Vector Smart Map.' Digital Chart of the World is a comprehensive 1:1,000,000 scale vector basemap of the world. It consists of cartographic, attribute, and textual data. The primary source for the database is the National Imagery and Mapping Agency's (NIMA) Operational Navigation Chart (ONC) series. This is the largest scale unclassified map series in existence that provides consistent, continuous global coverage of essential basemap features. The coverage is is organized into 10 thematic layers which feature a vast number of files organized into libraries. These libraries, or coverages, are geographicially bounded areas, rather than feature-linked coverages. DCW Layers in the Harvard Geospatial Library are feature-based as we have processed the multiple tiles from the VMAP0 libraries into a series of seamless coverages (e.g. aeronautical features appear in a single layer, 'Aeronautical Facilities, Points') which depict a particular feature as it occurs throughout the available geographic coverage areas. Since different geographic areas were mapped by NIMA at different times using various types of feature capture and scanning and digitizing methods and software, multiple map sources of varying dates and multiple processing approaches are represented in each of these HGL layers. We have necessarily generalized the discussion of data source material and process steps in the Data Quality section of this metadata document.",Line,National Imagery and Mapping Agency (now National Geospatial-Intelligence Agency),Shapefile,1992,2005-2009,Northern Hemisphere,structure,"ENVELOPE(-149.439728, 175.173218, 71.252533, -52.929207)"
